CVE ID,Title,Description,CVSS v3.1 Score,Vendor,Product,datePublished,Attempted Exploitation,Reference,CWE,CWE-N
CVE-2025-31738,WordPress LeadQuizzes Plugin <= 1.1.0 - Stored Cross Site Scripting (XSS) vulnerability,Improper Neutralization of Input During Web Page Generation ('Cross-site Scripting') vulnerability in yazamodeveloper LeadQuizzes allows Stored XSS. This issue affects LeadQuizzes: from n/a through 1.1.0.,6.5,yazamodeveloper,LeadQuizzes,2025-04-01T14:51:05.140Z,no,1.0,CWE-79,1.0
CVE-2025-31740,"WordPress News, Magazine and Blog Elements Plugin <= 1.3 - Stored Cross Site Scripting (XSS) vulnerability","Improper Neutralization of Input During Web Page Generation ('Cross-site Scripting') vulnerability in aThemeArt News, Magazine and Blog Elements allows Stored XSS. This issue affects News, Magazine and Blog Elements: from n/a through 1.3.",6.5,aThemeArt,"News, Magazine and Blog Elements",2025-04-01T14:51:05.676Z,no,1.0,CWE-79,1.0
CVE-2025-31741,WordPress Easy Magazine plugin <= 2.1.13 - Cross Site Scripting (XSS) vulnerability,Improper Neutralization of Input During Web Page Generation ('Cross-site Scripting') vulnerability in Filtr8 Easy Magazine allows DOM-Based XSS. This issue affects Easy Magazine: from n/a through 2.1.13.,6.5,Filtr8,Easy Magazine,2025-04-01T14:51:06.199Z,no,1.0,CWE-79,1.0
CVE-2025-31742,WordPress Dima Take Action Plugin <= 1.0.5 - Cross Site Scripting (XSS) vulnerability,Improper Neutralization of Input During Web Page Generation ('Cross-site Scripting') vulnerability in PixelDima Dima Take Action allows Stored XSS. This issue affects Dima Take Action: from n/a through 1.0.5.,5.9,PixelDima,Dima Take Action,2025-04-01T14:51:06.707Z,no,1.0,CWE-79,1.0
CVE-2025-31743,WordPress Lightweight and Responsive Youtube Embed Plugin <= 1.0.0 - Stored Cross Site Scripting (XSS) vulnerability,Improper Neutralization of Input During Web Page Generation ('Cross-site Scripting') vulnerability in wpszaki Lightweight and Responsive Youtube Embed allows Stored XSS. This issue affects Lightweight and Responsive Youtube Embed: from n/a through 1.0.0.,6.5,wpszaki,Lightweight and Responsive Youtube Embed,2025-04-01T14:51:07.208Z,no,1.0,CWE-79,1.0
CVE-2025-31744,WordPress Lightweight and Responsive Youtube Embed plugin <= 1.0.0 - Stored Cross Site Scripting (XSS) vulnerability,Improper Neutralization of Input During Web Page Generation ('Cross-site Scripting') vulnerability in wpszaki Lightweight and Responsive Youtube Embed allows Stored XSS. This issue affects Lightweight and Responsive Youtube Embed: from n/a through 1.0.0.,6.5,wpszaki,Lightweight and Responsive Youtube Embed,2025-04-01T14:51:07.706Z,no,1.0,CWE-79,1.0
CVE-2025-31745,WordPress Subscription Form for Feedblitz Plugin <= 1.0.9 - Cross Site Scripting (XSS) vulnerability,Improper Neutralization of Input During Web Page Generation ('Cross-site Scripting') vulnerability in Arni Cinco Subscription Form for Feedblitz allows Stored XSS. This issue affects Subscription Form for Feedblitz: from n/a through 1.0.9.,6.5,Arni Cinco,Subscription Form for Feedblitz,2025-04-01T14:51:08.224Z,no,1.0,CWE-79,1.0
CVE-2025-31747,WordPress WP Chrono plugin <= 1.5.4 - Cross Site Scripting (XSS) vulnerability,Improper Neutralization of Input During Web Page Generation ('Cross-site Scripting') vulnerability in milan.latinovic WP Chrono allows DOM-Based XSS. This issue affects WP Chrono: from n/a through 1.5.4.,6.5,milan.latinovic,WP Chrono,2025-04-01T14:51:08.737Z,no,1.0,CWE-79,1.0
CVE-2025-31748,WordPress Opal Portfolio Plugin <= 1.0.4 - Stored Cross Site Scripting (XSS) vulnerability,Improper Neutralization of Input During Web Page Generation ('Cross-site Scripting') vulnerability in wpopal Opal Portfolio allows Stored XSS. This issue affects Opal Portfolio: from n/a through 1.0.4.,6.5,wpopal,Opal Portfolio,2025-04-01T14:51:09.239Z,no,1.0,CWE-79,1.0
CVE-2025-31749,WordPress  HMH Footer Builder For Elementor plugin <= 1.0 - Cross Site Scripting (XSS) vulnerability,Improper Neutralization of Input During Web Page Generation ('Cross-site Scripting') vulnerability in WPelite HMH Footer Builder For Elementor allows Stored XSS. This issue affects HMH Footer Builder For Elementor: from n/a through 1.0.,6.5,WPelite,HMH Footer Builder For Elementor,2025-04-01T14:51:09.768Z,no,1.0,CWE-79,1.0
CVE-2025-31750,WordPress Breaking News WP Plugin <= 1.3 - Cross Site Scripting (XSS) vulnerability,Improper Neutralization of Input During Web Page Generation ('Cross-site Scripting') vulnerability in doit Breaking News WP allows Stored XSS. This issue affects Breaking News WP: from n/a through 1.3.,5.9,doit,Breaking News WP,2025-04-01T14:51:10.293Z,no,1.0,CWE-79,1.0
CVE-2025-31751,WordPress Breaking News WP Plugin <= 1.3 - CSRF to Settings Change vulnerability,Cross-Site Request Forgery (CSRF) vulnerability in doit Breaking News WP allows Cross Site Request Forgery. This issue affects Breaking News WP: from n/a through 1.3.,6.5,doit,Breaking News WP,2025-04-01T14:51:10.966Z,no,1.0,CWE-352,1.0
CVE-2025-31752,WordPress Bulk Fields Editor plugin <= 1.8.0 - Broken Access Control vulnerability,Missing Authorization vulnerability in termel Bulk Fields Editor allows Exploiting Incorrectly Configured Access Control Security Levels. This issue affects Bulk Fields Editor: from n/a through 1.8.0.,4.3,termel,Bulk Fields Editor,2025-04-01T14:51:11.583Z,no,1.0,CWE-862,1.0
CVE-2025-31753,WordPress Advanced Speed Increaser Plugin <= 2.2.1 - Cross Site Request Forgery (CSRF) vulnerability,Cross-Site Request Forgery (CSRF) vulnerability in Animesh Kumar Advanced Speed Increaser. This issue affects Advanced Speed Increaser: from n/a through 2.2.1.,4.3,Animesh Kumar,Advanced Speed Increaser,2025-04-01T20:42:09.765Z,no,1.0,CWE-352,1.0
CVE-2025-31754,WordPress DobsonDev Shortcodes plugin <= 2.1.12 - Stored Cross Site Scripting (XSS) vulnerability,Improper Neutralization of Input During Web Page Generation ('Cross-site Scripting') vulnerability in DobsonDev DobsonDev Shortcodes allows Stored XSS. This issue affects DobsonDev Shortcodes: from n/a through 2.1.12.,6.5,DobsonDev,DobsonDev Shortcodes,2025-04-01T14:51:12.129Z,no,1.0,CWE-79,1.0
CVE-2025-31755,WordPress pCloud Backup plugin <= 1.0.1 - Broken Access Control vulnerability,Missing Authorization vulnerability in josselynj pCloud Backup allows Exploiting Incorrectly Configured Access Control Security Levels. This issue affects pCloud Backup: from n/a through 1.0.1.,4.3,josselynj,pCloud Backup,2025-04-01T14:51:12.650Z,no,1.0,CWE-862,1.0
CVE-2025-31756,WordPress TZ PlusGallery Plugin <= 1.5.5 - Cross Site Request Forgery (CSRF) vulnerability,Cross-Site Request Forgery (CSRF) vulnerability in tuyennv TZ PlusGallery allows Cross Site Request Forgery. This issue affects TZ PlusGallery: from n/a through 1.5.5.,4.3,tuyennv,TZ PlusGallery,2025-04-01T14:51:13.185Z,no,1.0,CWE-352,1.0
CVE-2025-31757,WordPress Free Woocommerce Product Table View plugin <= 1.78 - Broken Access Control vulnerability,Missing Authorization vulnerability in BinaryCarpenter Free Woocommerce Product Table View allows Exploiting Incorrectly Configured Access Control Security Levels. This issue affects Free Woocommerce Product Table View: from n/a through 1.78.,5.4,BinaryCarpenter,Free Woocommerce Product Table View,2025-04-01T14:51:13.704Z,no,1.0,CWE-862,1.0
CVE-2025-31759,WordPress Boo Recipes plugin <= 2.4.1 - Cross Site Scripting (XSS) vulnerability,Improper Neutralization of Input During Web Page Generation ('Cross-site Scripting') vulnerability in BooSpot Boo Recipes allows Stored XSS. This issue affects Boo Recipes: from n/a through 2.4.1.,6.5,BooSpot,Boo Recipes,2025-04-01T14:51:14.211Z,no,1.0,CWE-79,1.0
CVE-2025-31760,WordPress SnapWidget Social Photo Feed Widget plugin <= 1.1.0 - Cross Site Scripting (XSS) vulnerability,Improper Neutralization of Input During Web Page Generation ('Cross-site Scripting') vulnerability in snapwidget SnapWidget Social Photo Feed Widget allows DOM-Based XSS. This issue affects SnapWidget Social Photo Feed Widget: from n/a through 1.1.0.,6.5,snapwidget,SnapWidget Social Photo Feed Widget,2025-04-01T14:51:14.727Z,no,1.0,CWE-79,1.0
CVE-2025-31761,WordPress Hypotext plugin <= 1.0.1 - Cross Site Scripting (XSS) vulnerability,Improper Neutralization of Input During Web Page Generation ('Cross-site Scripting') vulnerability in DEJAN Hypotext allows Stored XSS. This issue affects Hypotext: from n/a through 1.0.1.,6.5,DEJAN,Hypotext,2025-04-01T14:51:15.256Z,no,1.0,CWE-79,1.0
CVE-2025-31762,WordPress Sheet2Site plugin <= 1.0.18 - Cross Site Scripting (XSS) vulnerability,Improper Neutralization of Input During Web Page Generation ('Cross-site Scripting') vulnerability in andreyazimov Sheet2Site allows Stored XSS. This issue affects Sheet2Site: from n/a through 1.0.18.,6.5,andreyazimov,Sheet2Site,2025-04-01T14:51:15.765Z,no,1.0,CWE-79,1.0
CVE-2025-31763,WordPress Cache control by Cacholong Plugin <= 5.4.1 - Cross Site Request Forgery (CSRF) vulnerability,Cross-Site Request Forgery (CSRF) vulnerability in Preliot Cache control by Cacholong allows Cross Site Request Forgery. This issue affects Cache control by Cacholong: from n/a through 5.4.1.,4.3,Preliot,Cache control by Cacholong,2025-04-01T14:51:16.279Z,no,1.0,CWE-352,1.0
CVE-2025-31764,WordPress Cache control by Cacholong plugin <= 5.4.1 - Cross Site Scripting (XSS) vulnerability,Improper Neutralization of Input During Web Page Generation ('Cross-site Scripting') vulnerability in Preliot Cache control by Cacholong allows Stored XSS. This issue affects Cache control by Cacholong: from n/a through 5.4.1.,5.9,Preliot,Cache control by Cacholong,2025-04-01T14:51:16.778Z,no,1.0,CWE-79,1.0
CVE-2025-31765,WordPress GDPR Cookie Notice plugin <= 1.2.0 - Broken Access Control vulnerability,Missing Authorization vulnerability in themeqx GDPR Cookie Notice allows Exploiting Incorrectly Configured Access Control Security Levels. This issue affects GDPR Cookie Notice: from n/a through 1.2.0.,5.3,themeqx,GDPR Cookie Notice,2025-04-01T14:51:17.281Z,no,1.0,CWE-862,1.0
CVE-2025-31766,WordPress PhotoShelter for Photographers Blog Feed plugin <= 1.5.7 - Cross Site Scripting (XSS) vulnerability,Improper Neutralization of Input During Web Page Generation ('Cross-site Scripting') vulnerability in PhotoShelter PhotoShelter for Photographers Blog Feed Plugin allows Stored XSS. This issue affects PhotoShelter for Photographers Blog Feed Plugin: from n/a through 1.5.7.,6.5,PhotoShelter,PhotoShelter for Photographers Blog Feed Plugin,2025-04-01T14:51:17.794Z,no,1.0,CWE-79,1.0
CVE-2025-31767,WordPress Post Custom Templates Lite plugin <= 1.14 - Stored Cross Site Scripting (XSS) vulnerability,Improper Neutralization of Input During Web Page Generation ('Cross-site Scripting') vulnerability in OTWthemes  Post Custom Templates Lite allows Stored XSS. This issue affects  Post Custom Templates Lite: from n/a through 1.14.,6.5,OTWthemes,Post Custom Templates Lite,2025-04-01T14:51:18.309Z,no,1.0,CWE-79,1.0
CVE-2025-31769,WordPress CLP – Custom Login Page by NiteoThemes plugin <= 1.5.5 - Cross Site Request Forgery (CSRF) vulnerability,Cross-Site Request Forgery (CSRF) vulnerability in NiteoThemes CLP – Custom Login Page by NiteoThemes allows Cross Site Request Forgery. This issue affects CLP – Custom Login Page by NiteoThemes: from n/a through 1.5.5.,4.3,NiteoThemes,CLP – Custom Login Page by NiteoThemes,2025-04-01T14:51:18.860Z,no,1.0,CWE-352,1.0
CVE-2025-31770,WordPress  Content Manager Light plugin <= 3.2 - Cross Site Scripting (XSS) vulnerability,Improper Neutralization of Input During Web Page Generation ('Cross-site Scripting') vulnerability in OTWthemes Content Manager Light allows Stored XSS. This issue affects Content Manager Light: from n/a through 3.2.,6.5,OTWthemes,Content Manager Light,2025-04-01T14:51:19.428Z,no,1.0,CWE-79,1.0
CVE-2025-31771,WordPress Team Members for Elementor Page Builder plugin <= 1.0.4 - Cross Site Scripting (XSS) vulnerability,Improper Neutralization of Input During Web Page Generation ('Cross-site Scripting') vulnerability in Sultan Nasir Uddin Team Members for Elementor Page Builder allows Stored XSS. This issue affects Team Members for Elementor Page Builder: from n/a through 1.0.4.,6.5,Sultan Nasir Uddin,Team Members for Elementor Page Builder,2025-04-01T14:51:19.963Z,no,1.0,CWE-79,1.0
CVE-2025-31772,WordPress WP Modal Popup with Cookie Integration plugin <= 2.4 - Cross Site Scripting (XSS) vulnerability,Improper Neutralization of Input During Web Page Generation ('Cross-site Scripting') vulnerability in Astoundify WP Modal Popup with Cookie Integration allows Stored XSS. This issue affects WP Modal Popup with Cookie Integration: from n/a through 2.4.,5.9,Astoundify,WP Modal Popup with Cookie Integration,2025-04-01T14:51:20.508Z,no,1.0,CWE-79,1.0
CVE-2025-31773,WordPress Ship Per Product plugin <= 2.1.0 - Broken Access Control vulnerability,Missing Authorization vulnerability in cedcommerce Ship Per Product allows Accessing Functionality Not Properly Constrained by ACLs. This issue affects Ship Per Product: from n/a through 2.1.0.,5.3,cedcommerce,Ship Per Product,2025-04-01T14:51:21.029Z,no,1.0,CWE-862,1.0
CVE-2025-31774,WordPress Astra Security Suite plugin<= 0.2 - Broken Access Control vulnerability,Missing Authorization vulnerability in WebProtect.ai Astra Security Suite allows Exploiting Incorrectly Configured Access Control Security Levels. This issue affects Astra Security Suite: from n/a through 0.2.,5.3,WebProtect.ai,Astra Security Suite,2025-04-01T14:51:21.580Z,no,1.0,CWE-862,1.0
CVE-2025-31775,WordPress Google SEO Pressor for Rich snippets Plugin <= 2.0 - Cross Site Request Forgery (CSRF) vulnerability,Cross-Site Request Forgery (CSRF) vulnerability in smackcoders Google SEO Pressor Snippet allows Cross Site Request Forgery. This issue affects Google SEO Pressor Snippet: from n/a through 2.0.,4.3,smackcoders,Google SEO Pressor Snippet,2025-04-01T14:51:22.084Z,no,1.0,CWE-352,1.0
CVE-2025-31776,WordPress Uptime Robot Plugin <= 2.3 - Cross Site Request Forgery (CSRF) vulnerability,Cross-Site Request Forgery (CSRF) vulnerability in Aphotrax Uptime Robot Plugin for WordPress allows Cross Site Request Forgery. This issue affects Uptime Robot Plugin for WordPress: from n/a through 2.3.,4.3,Aphotrax,Uptime Robot Plugin for WordPress,2025-04-01T14:51:22.600Z,no,1.0,CWE-352,1.0
CVE-2025-31777,WordPress Clockinator Lite plugin <= 1.0.7 - Broken Access Control vulnerability,Missing Authorization vulnerability in BeastThemes Clockinator Lite allows Exploiting Incorrectly Configured Access Control Security Levels. This issue affects Clockinator Lite: from n/a through 1.0.7.,5.3,BeastThemes,Clockinator Lite,2025-04-01T14:51:23.123Z,no,1.0,CWE-862,1.0
CVE-2025-31778,WordPress Donate Me Plugin <= 1.2.5 - Stored Cross-Site Scripting vulnerability,Improper Neutralization of Input During Web Page Generation ('Cross-site Scripting') vulnerability in raphaelheide Donate Me allows Reflected XSS. This issue affects Donate Me: from n/a through 1.2.5.,6.5,raphaelheide,Donate Me,2025-04-01T14:51:23.646Z,no,1.0,CWE-79,1.0
CVE-2025-31779,WordPress Query Wrangler plugin <= 1.5.53 - Cross Site Request Forgery (CSRF) vulnerability,Cross-Site Request Forgery (CSRF) vulnerability in Jonathan Daggerhart Query Wrangler allows Cross Site Request Forgery. This issue affects Query Wrangler: from n/a through 1.5.53.,5.4,Jonathan Daggerhart,Query Wrangler,2025-04-01T14:51:24.164Z,no,1.0,CWE-352,1.0
CVE-2025-31780,WordPress Append Content plugin <= 2.1.1 - CSRF to Settings Change vulnerability,Missing Authorization vulnerability in Andy Stratton Append Content allows Exploiting Incorrectly Configured Access Control Security Levels. This issue affects Append Content: from n/a through 2.1.1.,6.5,Andy Stratton,Append Content,2025-04-01T14:51:24.680Z,no,1.0,CWE-862,1.0
CVE-2025-31781,WordPress Gift Cards for WooCommerce plugin <= 1.5.8 - Broken Access Control vulnerability,Missing Authorization vulnerability in ahmadshyk Gift Cards for WooCommerce allows Exploiting Incorrectly Configured Access Control Security Levels. This issue affects Gift Cards for WooCommerce: from n/a through 1.5.8.,4.3,ahmadshyk,Gift Cards for WooCommerce,2025-04-01T14:51:25.219Z,no,1.0,CWE-862,1.0
CVE-2025-31782,WordPress mb.YTPlayer plugin <= 3.3.8 - Broken Access Control vulnerability,Missing Authorization vulnerability in pupunzi mb.YTPlayer allows Exploiting Incorrectly Configured Access Control Security Levels. This issue affects mb.YTPlayer: from n/a through 3.3.8.,5.4,pupunzi,mb.YTPlayer,2025-04-01T14:51:25.735Z,no,1.0,CWE-862,1.0
CVE-2025-31783,WordPress Leartes TRY Exchange Rates Plugin <= 2.1 - Stored Cross Site Scripting (XSS) vulnerability,Improper Neutralization of Input During Web Page Generation ('Cross-site Scripting') vulnerability in Leartes.NET Leartes TRY Exchange Rates allows Stored XSS. This issue affects Leartes TRY Exchange Rates: from n/a through 2.1.,6.5,Leartes.NET,Leartes TRY Exchange Rates,2025-04-01T14:51:26.241Z,no,1.0,CWE-79,1.0
CVE-2025-31784,"WordPress Embed Extended – Embed Maps, Videos, Websites, Source Codes, and more Plugin <= 1.4.0 - Cross Site Request Forgery (CSRF) vulnerability","Cross-Site Request Forgery (CSRF) vulnerability in Rudy Susanto Embed Extended – Embed Maps, Videos, Websites, Source Codes, and more allows Cross Site Request Forgery. This issue affects Embed Extended – Embed Maps, Videos, Websites, Source Codes, and more: from n/a through 1.4.0.",4.3,Rudy Susanto,"Embed Extended – Embed Maps, Videos, Websites, Source Codes, and more",2025-04-01T14:51:26.746Z,no,1.0,CWE-352,1.0
CVE-2025-31785,WordPress Clearbit Reveal plugin <= 1.0.6 - Cross Site Request Forgery (CSRF) vulnerability,Cross-Site Request Forgery (CSRF) vulnerability in Clearbit Clearbit Reveal allows Cross Site Request Forgery. This issue affects Clearbit Reveal: from n/a through 1.0.6.,5.4,Clearbit,Clearbit Reveal,2025-04-01T14:51:27.267Z,no,1.0,WE-352,1.0
CVE-2025-31786,WordPress Simple Icons plugin <= 2.8.4 - Broken Access Control vulnerability,Missing Authorization vulnerability in Travis Simple Icons allows Exploiting Incorrectly Configured Access Control Security Levels. This issue affects Simple Icons: from n/a through 2.8.4.,5.3,Travis,Simple Icons,2025-04-01T14:51:27.774Z,no,1.0,CWE-862,1.0
CVE-2025-31787,WordPress Cue by AudioTheme.com plugin <= 2.4.4 - Broken Access Control vulnerability,Missing Authorization vulnerability in Brady Vercher Cue allows Exploiting Incorrectly Configured Access Control Security Levels. This issue affects Cue: from n/a through 2.4.4.,4.3,Brady Vercher,Cue,2025-04-01T14:51:28.460Z,no,1.0,CWE-862,1.0
CVE-2025-31788,"WordPress AIO Performance Profiler, Monitor, Optimize, Compress & Debug plugin <= 1.2 - Sensitive Data Exposure vulnerability","Insertion of Sensitive Information into Log File vulnerability in smackcoders AIO Performance Profiler, Monitor, Optimize, Compress & Debug allows Retrieve Embedded Sensitive Data. This issue affects AIO Performance Profiler, Monitor, Optimize, Compress & Debug: from n/a through 1.2.",5.3,smackcoders,"AIO Performance Profiler, Monitor, Optimize, Compress & Debug",2025-04-01T14:51:29.126Z,no,1.0,CWE-532,1.0
CVE-2025-31790,WordPress Posten plugin <= 0.0.1 - Cross Site Scripting (XSS) vulnerability,Improper Neutralization of Input During Web Page Generation ('Cross-site Scripting') vulnerability in Binsaifullah Posten allows DOM-Based XSS. This issue affects Posten: from n/a through 0.0.1.,6.5,Binsaifullah,Posten,2025-04-01T14:51:29.670Z,no,1.0,CWE-79,1.0
CVE-2025-31791,WordPress Pin Generator Plugin <= 2.0.0 - Broken Access Control vulnerability,Missing Authorization vulnerability in Oliver Boyers Pin Generator allows Exploiting Incorrectly Configured Access Control Security Levels. This issue affects Pin Generator: from n/a through 2.0.0.,5.4,Oliver Boyers,Pin Generator,2025-04-01T14:51:30.237Z,no,1.0,CWE-862,1.0
CVE-2025-31792,WordPress Piotnet Forms plugin <= 1.0.30 - Cross Site Scripting (XSS) vulnerability,Improper Neutralization of Input During Web Page Generation ('Cross-site Scripting') vulnerability in piotnetdotcom Piotnet Forms allows Stored XSS. This issue affects Piotnet Forms: from n/a through 1.0.30.,5.9,piotnetdotcom,Piotnet Forms,2025-04-01T14:51:30.774Z,no,1.0,CWE-79,1.0
CVE-2025-31793,WordPress Piotnet Forms plugin <= 1.0.30 - Cross Site Scripting (XSS) vulnerability,Improper Neutralization of Input During Web Page Generation ('Cross-site Scripting') vulnerability in piotnetdotcom Piotnet Forms allows Stored XSS. This issue affects Piotnet Forms: from n/a through 1.0.30.,5.9,piotnetdotcom,Piotnet Forms,2025-04-01T14:51:31.310Z,no,1.0,CWE-79,1.0
CVE-2025-31796,WordPress ElementsCSS Addons for Elementor plugin <= 1.0.8.7 - Server Side Request Forgery (SSRF) vulnerability,Server-Side Request Forgery (SSRF) vulnerability in TheInnovs Team ElementsCSS Addons for Elementor allows Server Side Request Forgery. This issue affects ElementsCSS Addons for Elementor: from n/a through 1.0.8.7.,5.4,TheInnovs Team,ElementsCSS Addons for Elementor,2025-04-01T14:51:31.846Z,no,1.0,CWE-918,1.0
CVE-2025-31797,WordPress Sprout Clients plugin <= 3.2 - Cross Site Scripting (XSS) vulnerability,Improper Neutralization of Input During Web Page Generation ('Cross-site Scripting') vulnerability in BoldGrid Sprout Clients allows Stored XSS. This issue affects Sprout Clients: from n/a through 3.2.,6.5,BoldGrid,Sprout Clients,2025-04-01T14:51:32.434Z,no,1.0,CWE-79,1.0
CVE-2025-31798,WordPress Publitio Plugin <= 2.1.8 - Broken Access Control vulnerability,Missing Authorization vulnerability in publitio Publitio allows Exploiting Incorrectly Configured Access Control Security Levels. This issue affects Publitio: from n/a through 2.1.8.,4.3,publitio,Publitio,2025-04-01T14:51:33.336Z,no,1.0,CWE-862,1.0
CVE-2025-31799,WordPress Publitio plugin <= 2.1.8 - Broken Access Control vulnerability,Missing Authorization vulnerability in publitio Publitio allows Exploiting Incorrectly Configured Access Control Security Levels. This issue affects Publitio: from n/a through 2.1.8.,4.3,publitio,Publitio,2025-04-01T14:51:33.933Z,no,1.0,CWE-862,1.0
CVE-2025-31801,WordPress MX Time Zone Clocks plugin <= 5.1.1 - Cross Site Scripting (XSS) vulnerability,Improper Neutralization of Input During Web Page Generation ('Cross-site Scripting') vulnerability in Maksym Marko MX Time Zone Clocks allows Reflected XSS. This issue affects MX Time Zone Clocks: from n/a through 5.1.1.,6.5,Maksym Marko,MX Time Zone Clocks,2025-04-01T14:51:34.501Z,no,1.0,CWE-79,1.0
CVE-2025-31802,WordPress Shiptimize for WooCommerce plugin <= 3.1.86 - Settings Change vulnerability,Missing Authorization vulnerability in Shiptimize Shiptimize for WooCommerce allows Exploiting Incorrectly Configured Access Control Security Levels. This issue affects Shiptimize for WooCommerce: from n/a through 3.1.86.,5.4,Shiptimize,Shiptimize for WooCommerce,2025-04-01T14:51:35.057Z,no,1.0,CWE-862,1.0
CVE-2025-31803,WordPress Turisbook Booking System plugin <= 1.3.7 - Stored Cross Site Scripting (XSS) vulnerability,Improper Neutralization of Input During Web Page Generation ('Cross-site Scripting') vulnerability in Neteuro Turisbook Booking System allows Stored XSS. This issue affects Turisbook Booking System: from n/a through 1.3.7.,6.5,Neteuro,Turisbook Booking System,2025-04-01T14:51:35.752Z,no,1.0,CWE-79,1.0
CVE-2025-31804,WordPress Follow Us Badges plugin <= 3.1.11 - Cross Site Scripting (XSS) vulnerability,Improper Neutralization of Input During Web Page Generation ('Cross-site Scripting') vulnerability in DraftPress Team Follow Us Badges allows Stored XSS. This issue affects Follow Us Badges: from n/a through 3.1.11.,6.5,DraftPress Team,Follow Us Badges,2025-04-01T14:51:36.333Z,no,1.0,CWE-79,1.0
CVE-2025-31805,WordPress Gutena Kit plugin <= 2.0.7 - Cross Site Scripting (XSS) vulnerability,Improper Neutralization of Input During Web Page Generation ('Cross-site Scripting') vulnerability in ExpressTech Systems Gutena Kit – Gutenberg Blocks and Templates allows Stored XSS. This issue affects Gutena Kit – Gutenberg Blocks and Templates: from n/a through 2.0.7.,6.5,ExpressTech Systems,Gutena Kit – Gutenberg Blocks and Templates,2025-04-01T14:51:36.930Z,no,1.0,CWE-79,1.0
CVE-2025-31806,WordPress Webling Plugin <= 3.9.0 - Cross Site Scripting (XSS) vulnerability,Improper Neutralization of Input During Web Page Generation ('Cross-site Scripting') vulnerability in uSystems Webling allows Stored XSS. This issue affects Webling: from n/a through 3.9.0.,5.9,uSystems,Webling,2025-04-01T14:51:37.549Z,no,1.0,CWE-79,1.0
CVE-2025-31807,WordPress Product Notices for WooCommerce plugin <= 1.3.3 - Cross Site Request Forgery (CSRF) vulnerability,Cross-Site Request Forgery (CSRF) vulnerability in CloudRedux Product Notices for WooCommerce allows Cross Site Request Forgery. This issue affects Product Notices for WooCommerce: from n/a through 1.3.3.,4.3,CloudRedux,Product Notices for WooCommerce,2025-04-01T14:51:38.153Z,no,1.0,CWE-352,1.0
CVE-2025-31808,WordPress SCSS WP Editor Plugin <= 1.1.8 - Cross Site Request Forgery (CSRF) vulnerability,Cross-Site Request Forgery (CSRF) vulnerability in IT Path Solutions SCSS WP Editor allows Cross Site Request Forgery. This issue affects SCSS WP Editor: from n/a through 1.1.8.,4.3,IT Path Solutions,SCSS WP Editor,2025-04-01T14:51:38.730Z,no,1.0,CWE-352,1.0
CVE-2025-31809,WordPress Labinator Content Types Duplicator Plugin <= 1.1.3 - Cross Site Request Forgery (CSRF) vulnerability,Cross-Site Request Forgery (CSRF) vulnerability in Labinator Labinator Content Types Duplicator allows Cross Site Request Forgery. This issue affects Labinator Content Types Duplicator: from n/a through 1.1.3.,4.3,Labinator,Labinator Content Types Duplicator,2025-04-01T14:51:39.281Z,no,1.0,CWE-352,1.0
